成交年月,型式,地址,成交總價(萬),單價(萬/坪),建物坪數,土地坪數,屋齡,樓層,總樓層,車位,房,廳,衛,lat,lon,備註
11403,公寓,台北市大安區永康街７５巷１６之１號三樓,730,96.61,7.56,3.05,52,3,4,無,3,2,2,25.028693,121.531019,親友、員工、共有人或其他特殊關係間之交易；
11403,公寓,台北市大安區青田街６巷１５號三樓,4230,104.49,40.48,14.67,52.9,3,4,無,4,2,2,25.028299,121.530719,陽台外推；其他增建；
11403,公寓,台北市大安區師大路１３５巷２號三樓,2030,89.99,22.56,6.96,58.3,3,4,無,3,2,1,25.021416,121.52815,陽台外推；其他增建；
11403,大樓,台北市大安區和平東路二段１００號六樓之７,3363,84.98,39.57,3.08,41.8,6,12,無,4,2,2,25.025444,121.540158,
11403,華廈,台北市大安區和平東路一段１８８巷１號三樓,6400,108.93,58.75,9,7.9,3,10,有,3,2,2,25.026079,121.53063,
11403,公寓,台北市大安區復興南路二段１５１巷４號四樓之１,368,86.96,4.23,1.05,48.4,4,5,無,1,1,1,25.028318,121.543991,親友、員工、共有人或其他特殊關係間之交易；
11403,公寓,台北市大安區羅斯福路二段１１７巷６之１號,1900,84.94,22.37,8.67,0,2,3,無,3,2,2,25.024582,121.525045,
11403,大樓,台北市大安區信義路三段１３４巷１００號十樓,4550,102.43,44.42,8.84,39.9,10,15,無,3,2,2,25.02991,121.539358,陽台外推；其他增建；
11403,公寓,台北市大安區青田街７巷１２弄５號,3168,139.69,22.68,5.3,30.3,1,5,無,2,2,1,25.027841,121.53372,其他增建；
11403,華廈,台北市大安區師大路５９巷９號七樓,1300,156.5,8.31,2.21,19.3,7,7,無,1,1,1,25.024005,121.529083,夾層；
11403,大樓,台北市大安區和平東路二段４０號十樓,1600,128.22,12.48,1.07,38.9,10,12,無,0,1,1,25.025528,121.537169,其他增建；
11403,大樓,台北市大安區和平東路一段１８５號九樓,3600,131.73,27.33,2.36,17.8,9,14,無,3,1,1,25.026409,121.533205,陽台外推；夾層；其他增建；
11403,公寓,台北市大安區永康街６１巷２號二樓,1344,74.45,18.05,4.38,52.3,2,7,無,4,2,2,25.029268,121.530001,權利人原持有部分，現再取得其他部分親友、員工、共有人或其他特殊關係間之交易；
11403,大樓,台北市大安區和平東路二段１００號十一樓,720,31.26,23.03,1.82,41.8,11,12,無,3,1,1,25.025444,121.540158,親友、員工、共有人或其他特殊關係間之交易；
11403,大樓,台北市大安區建國南路一段３４１巷３號三樓之１,2750,93.95,29.27,4.12,39.8,3,14,無,3,2,2,25.034498,121.5384,親友、員工、共有人或其他特殊關係間之交易；
11403,公寓,台北市大安區和平東路一段１８３巷７弄４號四樓,2400,98.12,24.46,7.14,43.1,4,5,無,2,2,1,25.027123,121.533326,陽台外推；其他增建；
11403,公寓,台北市大安區潮州街１１７號三樓,2641,46.91,56.3,14.28,31.1,3,5,無,3,2,2,25.028698,121.527897,親友、員工、共有人或其他特殊關係間之交易；
11403,大樓,台北市大安區和平東路一段１９１號十二樓,3280,129.76,25.28,2.41,7.3,12,14,無,2,2,1,25.026367,121.533731,陽台外推；夾層；其他增建；
11403,大樓,台北市大安區建國南路一段３３２之１號九樓,4850,122.97,41.19,5.49,19.2,9,13,有,1,2,1,25.034812,121.537586,土地交易價格：新台幣4570萬元整：建物交易價格：新台幣80萬元整 : 車位交易價格: 新台幣200萬元整陽台外推；
11403,公寓,台北市大安區建國南路二段１１巷３３號,4889,157.71,31,10.07,44.3,1,5,無,3,2,2,25.032929,121.538998,
11403,大樓,台北市大安區新生南路三段７０巷８號三樓,6238,152.94,50.41,6.44,1.6,3,12,有,3,2,2,25.019777,121.533298,
11403,公寓,台北市大安區師大路８０巷２號四樓,2800,88.1,31.78,11.95,49.6,4,4,無,3,2,2,25.023208,121.528151,陽台外推；其他增建；
11403,華廈,台北市大安區溫州街８３號五樓之６,2158,129.97,16.6,4.6,46.9,5,7,無,1,2,1,25.019501,121.53296,陽台外推；其他增建；
11403,大樓,台北市大安區復興南路二段１４８巷２號二樓,4068,97.08,41.9,6.68,45.3,2,11,無,4,2,2,25.028424,121.542168,陽台外推；
11403,大樓,台北市大安區信義路三段１０５號四樓之８,2188,144.49,15.14,1.27,19,4,14,無,1,1,1,25.033603,121.53884,其他增建；
11403,華廈,台北市大安區和平東路二段１８巷７之５號四樓,4000,96.63,41.4,9.83,50.2,4,7,無,3,2,2,25.024412,121.535996,
11403,公寓,台北市大安區師大路４９巷１３號三樓,1850,73.92,25.03,9.91,58.8,3,4,無,3,2,1,25.02434,121.529303,
11403,華廈,台北市大安區麗水街２１巷３之２７號,4450,90.84,48.99,12.13,54.7,7,7,無,4,2,2,25.028956,121.529128,陽台外推；頂樓加蓋；其他增建；
11403,華廈,台北市大安區瑞安街２０８巷４７弄２７號,2870,107.05,26.81,5.98,32.6,1,7,有,2,2,1,25.030027,121.541447,陽台外推；其他增建；
11403,大樓,台北市大安區和平東路一段６７號四樓之３,2600,106.96,24.31,1.7,36,4,19,無,2,2,1,25.027108,121.525133,陽台外推；其他增建；
11403,華廈,台北市大安區泰順街６０巷１８弄７號二樓,3456,124.58,27.74,7.17,14,2,7,無,2,1,1,25.022146,121.530034,
11403,華廈,台北市大安區復興南路二段１８０巷４號,700,19.48,35.94,4.04,39.6,1,6,無,3,1,2,25.027343,121.54295,親友、員工、共有人或其他特殊關係間之交易；
11403,華廈,台北市大安區師大路１０５巷１８號九樓之２,1320,159.43,8.28,1.45,18.3,9,10,無,1,1,1,25.022602,121.529163,陽台外推；夾層；其他增建；
11403,大樓,台北市大安區羅斯福路三段２７３號十二樓之３,3150,90.14,34.94,2.96,44.6,12,12,無,3,2,3,25.018469,121.530815,陽台外推；頂樓加蓋；其他增建；
11403,公寓,台北市大安區青田街１２巷８號,4750,136.52,34.79,13.84,53.8,1,4,無,3,2,2,25.026958,121.531591,土地價格：4725萬元整、建物價格：25萬元整。其他增建；
11403,華廈,台北市大安區復興南路二段１８０巷４號,700,19.48,35.94,4.04,39.6,1,6,無,3,1,2,25.027343,121.54295,親友、員工、共有人或其他特殊關係間之交易；
11403,華廈,台北市大安區永康街１３巷６號六樓,6358,112.46,64.48,12.25,25.5,6,6,有,1,1,2,25.032624,121.530199,陽台外推；其他增建；
11403,華廈,台北市大安區永康街４７巷２８號,1026,40.3,25.46,5.63,30.4,1,6,有,2,2,1,25.030288,121.531178,親友、員工、共有人或其他特殊關係間之交易；其他增建；
11403,公寓,台北市大安區潮州街１６６號,2268,84.01,27,8.31,0,1,4,無,4,1,1,25.028348,121.529431,親友、員工、共有人或其他特殊關係間之交易；
11403,公寓,台北市大安區泰順街５４巷６號四樓,3200,83.72,38.22,10.53,45.9,4,5,無,3,2,2,25.022623,121.530786,陽台外推；其他增建；
11403,華廈,台北市大安區羅斯福路三段２８３巷３６號五樓之７,2180,119.53,18.24,5.67,46.9,5,7,無,3,1,1,25.020252,121.531839,陽台外推；其他增建；
11403,大樓,台北市大安區和平東路一段１７７號十樓之１３,530,97.23,5.45,0.52,48,10,11,無,1,1,1,25.026569,121.531622,親友、員工、共有人或其他特殊關係間之交易；
