成交年月,型式,地址,成交總價(萬),單價(萬/坪),建物坪數,土地坪數,屋齡,樓層,總樓層,車位,房,廳,衛,lat,lon,備註
11501,華廈,台北市大安區瑞安街２０８巷５３弄７號三樓,2316,91.16,25.4,4.78,17.7,3,7,有,2,2,2,25.030411,121.540903,親友、員工、共有人或其他特殊關係間之交易；陽台外推；
11501,公寓,台北市大安區和平東路二段９６巷２０弄１９號二樓,2080,106.59,19.51,9.78,0,2,3,無,2,1,1,25.022489,121.539602,增建:陽台增建、懸空增建。陽台外推；
11501,公寓,台北市大安區泰順街４４巷２２之５號,5430,93.68,57.97,11.98,48.4,1,5,無,4,2,2,25.026476,121.534619,其他增建：天井增建、平台增建、壹樓空地增建。其他增建；
11501,大樓,台北市大安區建國南路二段７９巷１２號十七樓,3360,102.07,32.92,6.39,39.9,17,18,無,3,2,1,25.029823,121.538722,陽台外推；其他增建；
11501,華廈,台北市大安區和平東路二段１８巷５號四樓之１,6950,93.26,74.52,9.03,17.3,4,10,有,3,1,3,25.024651,121.536013,
11501,大樓,台北市大安區信義路三段１０５號二樓之８,2028,133.92,15.14,1.27,19,2,14,無,1,0,1,25.033603,121.53884,陽台外推；
11501,大樓,台北市大安區復興南路二段３０７號五樓,9028,134.25,67.25,6.36,1.2,5,23,有,4,2,2,25.024235,121.543712,土地價格:47739899元整。建物價格:42540101元整。車位位於地下五層。
11501,華廈,台北市大安區新生南路一段１６１巷８號之１五樓,6250,85.17,78.6,17.43,45.9,5,6,有,5,2,2,25.034652,121.535041,親友、員工、共有人或其他特殊關係間之交易；
11501,華廈,台北市大安區新生南路一段１６１巷８號之１四樓,6250,85.17,78.6,17.43,45.9,4,6,有,5,2,2,25.034652,121.535041,親友、員工、共有人或其他特殊關係間之交易；
11412,大樓,台北市大安區羅斯福路三段１５５號三樓之１,1748,117.12,14.93,1.32,1,3,15,無,1,1,1,25.021693,121.52753,
11412,公寓,台北市大安區辛亥路三段１５７巷２４弄１８號四樓,1370,68.92,19.88,5.51,47,4,5,無,2,2,1,25.026476,121.534619,陽台外推；其他增建；
11412,公寓,台北市大安區潮州街７８巷５號三樓,1500,113.47,13.22,6.98,50.2,3,4,無,3,2,2,25.026476,121.534619,本案移轉持分八分之三。親友、員工、共有人或其他特殊關係間之交易；
11412,華廈,台北市大安區新生南路一段１０３巷１１之２號,4800,96.87,49.55,11.15,54,3,7,無,3,2,2,25.026476,121.534619,有一個車位使用權
11412,華廈,台北市大安區新生南路三段８８號三樓之１,3998,102.31,39.08,7.15,44,3,7,無,3,2,2,25.01812,121.533348,陽台外推、陽台加窗。本案依土地法第34條之1第1項至第3項規定辦理。其他增建；
11412,華廈,台北市大安區麗水街１３巷３號五樓,2400,112.46,21.34,4.84,42.7,5,7,無,3,2,2,25.030278,121.5288,
11412,華廈,台北市大安區師大路６０號三樓之６,1100,104.7,10.51,1.84,17.3,3,9,無,0,0,1,25.024458,121.528665,親友、員工、共有人或其他特殊關係間之交易；
11412,華廈,台北市大安區羅斯福路二段１１７巷５號四樓,2660,100.27,26.53,4.92,7.4,4,7,有,1,1,1,25.024503,121.525262,
11412,大樓,台北市大安區和平東路二段１００號五樓之９,1500,134.45,11.16,0.85,41.8,5,12,無,0,1,1,25.025444,121.540158,
11412,大樓,台北市大安區羅斯福路三段２５３號二樓之１,3400,79.6,42.71,4.69,40.3,2,12,無,無隔間,0,0,25.019121,121.530154,親友、員工、共有人或其他特殊關係間之交易；
11412,華廈,台北市大安區和平東路一段８５巷１２號四樓,1868,156.73,11.92,2.99,20.3,4,7,無,1,0,1,25.028011,121.525492,
11412,公寓,台北市大安區青田街２巷１３號三樓,2500,99.8,25.05,9.3,51.5,3,4,無,2,2,1,25.02856,121.531275,陽台外推；其他增建；
11412,大樓,台北市大安區信義路二段１３０之１號十二樓之２,1718,135.22,12.71,1.31,30.1,12,12,無,2,0,1,25.021716,121.539749,陽台外推；夾層；
11412,大樓,台北市大安區羅斯福路三段１５５號五樓之３,1988,133.36,14.91,1.32,1,5,15,無,1,1,1,25.021693,121.52753,
11412,華廈,台北市大安區信義路三段１５０之１號四樓,688,63.85,10.78,1.2,47.7,4,8,無,5,2,2,25.033161,121.540684,親友、員工、共有人或其他特殊關係間之交易；
11412,華廈,台北市大安區和平東路二段１７５巷１５弄９號五樓,4900,103.9,47.16,9.96,39.2,5,7,無,4,2,2,25.026199,121.542219,其他增建；
11412,華廈,台北市大安區麗水街１３巷３號,4800,112.47,42.68,9.69,42.7,1,7,無,3,2,2,25.030278,121.5288,
11412,大樓,台北市大安區和平東路一段１４５號五樓之１,5123,96.55,53.06,3.21,40.3,5,12,有,無隔間,0,0,25.026617,121.53066,陽台外推；
11412,大樓,台北市大安區和平東路一段１９８號七樓,2779.5,75.01,37.06,3.88,49.3,7,11,無,1,2,2,25.026113,121.531225,土地價款：新臺幣25015500 元整。建物價款：新臺幣 2779500 不含營業稅元整。親友、員工、共有人或其他特殊關係間之交易；
11412,大樓,台北市大安區復興南路二段３０１號五樓,6739,145.69,56.11,5.1,1.2,5,23,有,3,2,2,25.024235,121.543712,
11412,華廈,台北市大安區金山南路二段１３２巷２０號二樓之５,100,110.56,0.9,0.26,28,2,6,無,1,1,1,25.029761,121.525768,親友、員工、共有人或其他特殊關係間之交易；
11412,大樓,台北市大安區建國南路二段１２３巷５號五樓,3666,97.21,37.71,7.34,39.9,5,18,無,3,2,2,25.032721,121.538169,陽台外推；
11412,大樓,台北市大安區羅斯福路三段１２５號七樓之１,1703.9059,71.65,23.78,2.55,47.5,7,12,無,2,2,1,25.022016,121.52698,親友、員工、共有人或其他特殊關係間之交易；
11412,大樓,台北市大安區信義路二段２４２號,788,70.06,11.25,1.3,39.4,1,12,無,無隔間,0,0,25.033416,121.532223,持分買賣親友、員工、共有人或其他特殊關係間之交易；
11411,公寓,台北市大安區金山南路二段１８５巷７號,800,66.55,12.02,3.86,0,"1,地下層",4,無,4,2,1,25.028437,121.526876,親友、員工、共有人或其他特殊關係間之交易；
11411,大樓,台北市大安區新生南路三段２號四樓之２,1360,121.31,11.21,1.02,47.3,4,14,無,1,1,1,25.025777,121.534623,
11411,公寓,台北市大安區永康街７５巷４號二樓,2600,97.34,26.71,7.79,51.8,2,4,無,3,2,1,25.028799,121.529978,陽台外推；其他增建；
11411,公寓,台北市大安區泰順街４０巷２０號二樓之１,2577,92.34,27.91,9.68,49.8,2,4,無,3,2,2,25.024284,121.530404,陽台外推；其他增建；
11411,華廈,台北市大安區師大路５９巷９號三樓之２,1415,159.92,8.85,2.34,19.3,3,7,無,1,1,1,25.024005,121.529083,夾層；
11411,華廈,台北市大安區青田街６巷１８號七樓之６,5237,136.6,38.34,5.43,2.2,7,10,有,2,1,2,25.028154,121.530791,
11411,大樓,台北市大安區和平東路一段１９１號十二樓之２,1850,130.18,14.21,1.37,7.3,12,14,無,1,1,1,25.026367,121.533731,夾層；
11411,大樓,台北市大安區復興南路二段２１８號三十四樓之７,8400,195.07,54.77,2.96,3.1,34,34,有,2,2,2,25.025932,121.543213,案名:安沐居
11411,大樓,台北市大安區信義路三段１０５號十一樓之８,2120,140,15.14,1.27,19,11,14,無,1,1,1,25.033603,121.53884,陽台外推；其他增建；
11411,公寓,台北市大安區青田街６巷１３號,4300,178.47,24.09,7.02,44.2,1,5,無,3,2,2,25.028233,121.531084,未登記建物為地下室未登記建物；
11411,華廈,台北市大安區瑞安街２０８巷５８弄９號六樓,6200,101.62,61.01,11.15,12.4,6,7,有,3,1,2,25.029992,121.540178,
11411,華廈,台北市大安區和平東路二段７６巷３１弄１５號二樓,1150,95.38,12.06,2.87,31.3,2,6,無,1,1,1,25.022144,121.539376,其他增建；
11411,大樓,台北市大安區信義路三段１０９之７號四樓之１,2250,94.73,23.75,2.3,30.8,4,13,無,1,1,1,25.033674,121.539411,親友、員工、共有人或其他特殊關係間之交易；
11411,華廈,台北市大安區金山南路二段１３巷２９號四樓,4520,129.24,34.98,11.6,54.9,4,6,無,4,2,2,25.033298,121.528791,陽台外推；
11411,華廈,台北市大安區辛亥路二段１４９號四樓,4198,102.12,41.11,7.41,40.3,4,7,無,4,2,2,25.021783,121.540124,陽台外推；其他增建；
11411,公寓,台北市大安區溫州街１６巷６之１號三樓,3132,85.11,36.8,11.37,48.5,3,5,無,4,2,2,25.025136,121.532921,
11411,華廈,台北市大安區麗水街１３巷１號二樓,4678,100.64,46.48,9.69,42.7,2,7,無,3,2,2,25.030374,121.528647,包含公共設施保留地用地；
11411,公寓,台北市大安區泰順街３９巷１號五樓,2680,75.2,35.64,10.93,43,5,5,無,3,2,2,25.022985,121.531362,陽台外推；其他增建；
11411,大樓,台北市大安區和平東路一段１７７之１號十二樓,3685,96.4,38.23,4.01,47.6,12,12,無,2,2,2,25.026481,121.532455,陽台外推；
11411,大樓,台北市大安區建國南路二段２０１號四樓,8412.174,102.6,81.99,11.27,36.3,4,12,無,3,2,2,25.027005,121.538061,含租約；
11411,公寓,台北市大安區師大路５９巷４號二樓,2100,64.73,32.44,13.16,55.2,2,4,無,3,2,2,25.023864,121.528867,賣方應納之土地增值稅由買方負擔。親友、員工、共有人或其他特殊關係間之交易；包含公共設施保留地用地；
11411,大樓,台北市大安區建國南路二段１２３巷７號九樓,3200,97.21,32.92,6.39,39.9,9,18,無,3,2,2,25.029767,121.53849,親友、員工、共有人或其他特殊關係間之交易；
11411,公寓,台北市大安區泰順街５４巷２１之４號,2785,96.2,28.95,10.74,54.9,3,4,無,3,2,2,25.022986,121.529683,一樓空地延伸增建空間、主建物內含梯廳空間陽台外推；其他增建；
11411,公寓,台北市大安區信義路二段１９８巷２０號,1220,33.23,36.71,6.8,42.4,1,5,無,6,3,3,25.033122,121.530442,親友、員工、共有人或其他特殊關係間之交易；
11411,大樓,台北市大安區復興南路二段２６８號二樓之２,23.75,0,0.25,0.02,37.1,2,12,無,1,0,0,25.025461,121.543741,親友、員工、共有人或其他特殊關係間之交易；
11410,大樓,台北市大安區信義路三段１０９之７號十一樓之１,3348,103.82,32.25,2.37,30.8,11,13,有,2,2,1,25.033674,121.539411,陽台外推；
11410,大樓,台北市大安區和平東路一段７５巷１號十二樓,4900,100.5,48.76,4.07,41.7,12,12,無,4,2,2,25.027273,121.525115,頂樓加蓋；
11410,大樓,台北市大安區新生南路三段７０巷６號五樓,6050,119.83,50.49,6.46,1.6,5,12,有,2,2,2,25.019645,121.533272,
11410,華廈,台北市大安區和平東路二段１１８巷４弄１９號六樓,2500,66.53,37.58,8.08,47.6,6,7,無,4,2,2,25.024042,121.542209,陽台外推；
11410,公寓,台北市大安區瑞安街７１巷５弄５號,2546,67.62,37.65,11.8,50.8,"1,地下層",4,無,3,1,3,25.028141,121.541778,壹樓空地增建、平台外推。親友、員工、共有人或其他特殊關係間之交易；其他增建；
11410,公寓,台北市大安區永康街２３巷２８之２號,2280,96.22,23.69,9.23,56.2,3,4,無,2,2,1,25.031902,121.531387,陽台外推；
11410,大樓,台北市大安區建國南路二段６７號十四樓,39216,246.01,178.73,20.9,7.6,14,35,有,無隔間,0,0,25.031489,121.53819,
11410,大樓,台北市大安區復興南路二段３０７號十八樓,10400,174.27,79.64,6.55,1.2,18,23,有,4,2,2,25.024235,121.543712,
11410,公寓,台北市大安區和平東路二段７６巷５弄３號四樓,264,40.74,6.48,1.72,47.2,4,5,無,3,2,2,25.024901,121.539365,親友、員工、共有人或其他特殊關係間之交易；
11410,大樓,台北市大安區辛亥路二段４１號十二樓之２,4800,82.46,58.21,3.49,37.1,12,25,有,3,2,2,25.022816,121.536267,陽台外推；其他增建；
11410,華廈,台北市大安區青田街６之３號五樓,6600,123.74,53.34,10.64,41.3,5,7,無,5,2,2,25.027952,121.531827,其他增建；
11410,大樓,台北市大安區復興南路二段１５７號十二樓,2500,79.24,31.55,2.63,46.3,12,12,無,無隔間,0,0,25.027858,121.543744,
11410,公寓,台北市大安區青田街７巷１０之２號三樓,3320,101.3,32.77,10.44,36.8,3,5,無,1,2,1,25.028044,121.533454,其他增建；
11410,華廈,台北市大安區和平東路一段１１９巷１８號五樓,4627,106.14,43.59,10.37,22.5,5,7,有,2,2,2,25.027499,121.527272,陽台外推；其他增建；
11410,公寓,台北市大安區辛亥路二段１７１巷９號三樓,2880,99.81,28.86,9.3,52.5,3,4,無,3,2,1,25.022112,121.541161,其他增建；
11410,華廈,台北市大安區羅斯福路三段２６９巷１５號四樓之１,1742,159.92,10.89,3.12,6.3,4,6,無,0,1,1,25.019666,121.530496,陽台外推；夾層；其他增建；
11410,公寓,台北市大安區永康街３１巷８號二樓,4400,111.67,39.4,10.1,39.3,2,5,無,4,2,2,25.031632,121.530418,其他增建；
11410,大樓,台北市大安區羅斯福路三段９９號十一樓,4980,75.66,65.82,5.54,27.3,11,11,有,0,3,2,25.022428,121.526592,陽台外推；夾層；其他增建；
11410,華廈,台北市大安區師大路８０巷１６號七樓,3000,135.5,22.14,5.41,20.3,7,7,無,1,2,1,25.023304,121.527403,其他增建；
11410,大樓,台北市大安區羅斯福路三段１５５號三樓之２,1980,132.82,14.91,1.32,1,3,15,無,1,1,1,25.021693,121.52753,
11409,公寓,台北市大安區泰順街４０巷２３之２號,2300,79.6,28.89,9.83,0,3,4,無,3,1,1,25.024409,121.529968,
11409,大樓,台北市大安區新生南路三段２５巷３號三樓,3780,100.74,37.52,5.37,40.4,3,12,無,3,2,2,25.024565,121.535096,陽台外推；其他增建；
11409,公寓,台北市大安區復興南路二段３５１號二樓,545.294,94.97,5.74,2.18,0,2,4,無,無隔間,0,0,25.023173,121.543559,兩位義務人交易金額各2726470元親友、員工、共有人或其他特殊關係間之交易；含租約；
11409,大樓,台北市大安區羅斯福路三段１５５號十樓之２,2188,146.6,14.93,1.32,1,10,15,無,1,1,1,25.021693,121.52753,
11409,華廈,台北市大安區復興南路二段１５１巷５號,3434,174.62,19.67,5.25,47.4,1,8,無,2,0,2,25.028482,121.543933,防火巷增建
11409,公寓,台北市大安區金山南路二段１５９巷１０號,2078,100.04,20.77,8.47,56.1,1,4,無,2,2,1,25.029037,121.527064,親友、員工、共有人或其他特殊關係間之交易；陽台外推；
11409,大樓,台北市大安區羅斯福路三段１５５號五樓之１,1850,103.38,17.9,1.59,1,5,15,無,1,1,1,25.021693,121.52753,
11409,公寓,台北市大安區瑞安街２０８巷６１弄４號,4432,168.25,26.34,8.89,53.5,1,4,無,2,2,2,25.030629,121.540737,
11409,華廈,台北市大安區師大路５９巷９號四樓之３,1500,152.76,9.82,2.57,19.3,4,7,無,1,1,1,25.024005,121.529083,夾層；其他增建；
11409,大樓,台北市大安區信義路三段１３４巷７４號九樓,3418,96.02,35.6,6.94,39.9,9,18,無,3,2,1,25.02976,121.538887,陽台外推；其他增建；
11409,大樓,台北市大安區信義路三段１３４巷５０號二樓,3000,91.78,32.69,6.39,39.9,2,14,無,3,2,2,25.029679,121.540019,
11409,大樓,台北市大安區和平東路一段１７７號五樓之９,1120,117.8,9.51,0.9,48,5,11,無,1,1,1,25.026569,121.531622,陽台增建陽台外推；其他增建；
11409,公寓,台北市大安區新生南路一段１６１巷３６之２號,3300,90.42,36.5,13.31,57.2,2,4,無,3,2,2,25.034463,121.536721,陽台外推；
11409,公寓,台北市大安區新生南路二段２巷７號二樓,2860,112.93,25.33,10.7,51.5,2,4,無,2,2,1,25.032917,121.532097,陽台外推；其他增建；
11409,大樓,台北市大安區建國南路二段１５１巷１９弄５號九樓,4088,98.23,41.61,8.29,39.9,9,18,無,3,2,2,25.029242,121.538865,陽台外推；其他增建；
11409,公寓,台北市大安區羅斯福路三段１７巷１弄３號三樓,1700,92.52,18.37,6.28,51.3,3,4,無,3,1,2,25.023853,121.525402,陽台外推；其他增建；
11409,公寓,台北市大安區瑞安街２０８巷１４弄４號二樓,2000,85.51,23.39,6.62,44.3,2,5,無,3,0,1,25.028206,121.540187,其他增建；
11409,大樓,台北市大安區建國南路二段７９巷１６號八樓,3000,91.14,32.92,6.39,39.9,8,18,無,3,2,2,25.030707,121.538791,陽台外推；其他增建；
11409,大樓,台北市大安區和平東路一段７７號十二樓,4800,103.62,46.32,3.94,41.7,12,12,無,4,2,2,25.027182,121.525165,頂樓加蓋；
11409,華廈,台北市大安區潮州街１５３號三樓,4700,77.86,60.36,9.93,16.3,3,7,有,3,1,1,25.028387,121.530324,陽台外推；其他增建；
11409,大樓,台北市大安區和平東路一段１８５號七樓之３,1610,161.48,9.97,0.86,17.8,7,14,無,1,1,1,25.026409,121.533205,陽台外推；夾層；其他增建；
11409,大樓,台北市大安區建國南路二段６７號七樓,31150,224.1,166.48,18.37,7.6,7,35,有,無隔間,0,0,25.031489,121.53819,
11409,華廈,台北市大安區瑞安街２０８巷４７弄２８號三樓之４,1180,104.64,11.28,2.94,30.8,3,6,無,1,2,1,25.029887,121.541699,陽台外推；夾層；其他增建；
11409,大樓,台北市大安區信義路二段２０６號三樓,15800,136.6,115.67,7.2,8,3,20,有,3,2,3,25.033338,121.530512,
11409,華廈,台北市大安區泰順街６０巷１５號二樓,3900,81.39,47.92,8.91,45.3,2,7,無,4,2,2,25.022498,121.530362,陽台外推；其他增建；
11409,大樓,台北市大安區建國南路二段１２３巷７號九樓,3200,97.21,32.92,6.39,39.9,9,18,無,3,2,2,25.029767,121.53849,陽台外推；其他增建；
11409,大樓,台北市大安區新生南路三段７０巷１０號七樓,1374,103.82,13.23,1.54,1.6,7,12,有,2,1,2,25.019777,121.533298,親友、員工、共有人或其他特殊關係間之交易；
11409,華廈,台北市大安區金山南路二段１３７號二樓,4010,83.84,47.83,8.97,48.7,2,7,無,1,2,2,25.029758,121.526791,
11409,大樓,台北市大安區信義路三段１３４巷９０號十樓,4300,96.81,44.42,8.84,39.9,10,18,無,3,2,2,25.02991,121.539358,陽台外推；其他增建；
11409,大樓,台北市大安區羅斯福路三段１５５號二樓,4200,140.77,29.84,2.65,1,2,15,無,2,2,2,25.021693,121.52753,親友、員工、共有人或其他特殊關係間之交易；
11409,華廈,台北市大安區和平東路二段２６５巷２８號五樓之１,985,87.74,11.23,2.29,31.7,5,7,無,1,1,1,25.026266,121.543978,其他增建；
11409,大樓,台北市大安區復興南路二段１６０巷１號十一樓之２,4280,140.07,30.56,3.33,7.2,11,15,無,0,1,1,25.027916,121.543025,
11409,公寓,台北市大安區金山南路二段１４１巷２０號二樓,2510,79.44,31.6,8.29,39.9,2,5,無,4,2,2,25.029376,121.527622,陽台外推；
11409,華廈,台北市大安區泰順街１６巷１６號六樓,1572,155.08,10.14,3.04,18.7,6,6,無,1,1,1,25.025418,121.530527,陽台外推；其他增建；
11409,華廈,台北市大安區潮州街１４５號三樓之１,1580,157.75,10.02,1.99,21.1,3,8,無,1,1,1,25.028401,121.530032,
11409,公寓,台北市大安區泰順街２６巷２９號四樓,2968,88.24,33.63,9.14,37.8,4,5,無,3,2,2,25.025133,121.530312,陽台外推；其他增建；
11409,公寓,台北市大安區復興南路二段３１８號三樓,2780,89.49,31.06,10.06,51.1,3,4,無,2,2,1,25.023342,121.543221,陽台外推；其他增建；
11408,大樓,台北市大安區復興南路二段３０３號十五樓,7850,170.32,56.13,5.11,1.2,15,23,有,3,2,2,25.024235,121.543712,交易總價：7850萬元整內含車位價土地價格:53945464元整、建物價格:24554536元整。
11408,大樓,台北市大安區辛亥路一段８９號四樓之３,4150,101.98,40.69,2.49,35.3,4,27,無,3,2,2,25.02172,121.530992,陽台外推；其他增建；
11408,華廈,台北市大安區師大路１２９號三樓之６,2030,99.67,20.37,3.99,0,3,7,無,1,2,1,25.021582,121.528372,其他增建；
11408,華廈,台北市大安區新生南路二段３０巷２８號三樓,6350,104.78,60.61,13.73,30.8,3,7,有,3,2,2,25.031028,121.530557,陽台外推；
11408,公寓,台北市大安區新生南路一段１５７巷３６之１號二樓,1900,66.12,28.74,10.3,49.5,2,4,無,2,2,2,25.035018,121.537268,親友、員工、共有人或其他特殊關係間之交易；
11408,華廈,台北市大安區信義路二段２２８巷１１號五樓,1288,123.99,10.39,2.71,0.8,5,6,無,無隔間,0,0,25.032799,121.531831,親友、員工、共有人或其他特殊關係間之交易；
11408,華廈,台北市大安區信義路二段２２８巷１１號五樓之１,1192,124.15,9.6,2.28,0.8,5,6,無,無隔間,0,0,25.032799,121.531831,親友、員工、共有人或其他特殊關係間之交易；
11408,大樓,台北市大安區復興南路二段２１８號三十四樓之５,8820,200.13,55.95,3.08,3.1,34,34,有,3,2,2,25.025932,121.543213,
11408,華廈,台北市大安區溫州街７４巷３弄１號五樓之１,1828,115.97,15.76,4.87,46.9,5,7,無,2,2,1,25.019575,121.53221,陽台外推；其他增建；
11408,華廈,台北市大安區信義路三段３１巷１２號六樓,747.5,124.99,5.98,1.12,1,6,10,無,1,1,1,25.034732,121.534413,親友、員工、共有人或其他特殊關係間之交易；
11408,大樓,台北市大安區復興南路二段３０３號六樓,3500,74.83,46.78,4.26,1.2,6,23,有,3,2,2,25.024235,121.543712,5位義務人買賣價金分別是700萬元親友、員工、共有人或其他特殊關係間之交易；
11408,華廈,台北市大安區羅斯福路三段２８３巷３６號四樓之１,1890,119.9,15.76,4.89,46.9,4,7,無,2,2,1,25.020252,121.531839,陽台外推；其他增建；
11408,華廈,台北市大安區瑞安街１３５巷２６號二樓,3720,92.99,40,8.53,42.6,2,7,無,4,2,2,25.026482,121.54151,其他增建；
11408,大樓,台北市大安區瑞安街１４２巷８號七樓之２,2078,141.2,14.72,3.23,18.8,7,13,無,1,2,1,25.029697,121.541746,其他增建；
11408,公寓,台北市大安區金山南路二段１５９巷１６號三樓,3020,100.47,30.06,8.41,48,3,5,無,3,2,1,25.02897,121.527343,陽台外推；其他增建；
11408,華廈,台北市大安區青田街７巷１２弄２號四樓,4000,108.45,36.88,8.98,38,4,6,無,3,2,2,25.0281,121.533572,
11408,大樓,台北市大安區建國南路二段５５號二十二樓,40175,267.01,174.63,20,7.6,22,31,有,無隔間,0,0,25.031783,121.538188,
11408,大樓,台北市大安區建國南路二段５７號二十二樓,40825,267.2,190.51,20.28,7.6,22,31,有,無隔間,0,0,25.031783,121.538188,
11408,大樓,台北市大安區和平東路一段１７７號五樓之３,2250,102.72,21.9,2.08,48,5,11,無,無隔間,0,0,25.026569,121.531622,陽台外推；
11408,華廈,台北市大安區師大路１０５巷１８號二樓之１,1500,146.23,10.26,1.76,18.3,2,10,無,1,1,1,25.022602,121.529163,陽台外推；夾層；
11408,大樓,台北市大安區辛亥路一段１３５號五樓之２,3000,74.29,40.38,5.74,42.5,5,14,無,3,2,2,25.022624,121.532283,陽台增建，出售價格拆分：102年10月1日取得土地、建物部分，14234149元整102年12月19日取得土地、建物部分，8365961元整103年1月16日取得土地、建物部分，7399890元整
11408,公寓,台北市大安區新生南路三段１１巷２號三樓,3620,91.41,39.6,11.4,41.6,3,5,無,3,2,2,25.025258,121.535314,陽台外推；
11408,大樓,台北市大安區信義路三段５９號三樓,19800,203.88,134.69,9.6,15.4,3,29,有,4,2,2,25.033958,121.536283,
11408,公寓,台北市大安區永康街３１之６號三樓之１,2050,115.69,17.72,5.36,49.8,3,4,無,2,2,1,25.031053,121.52955,陽台外推；其他增建；
11408,華廈,台北市大安區麗水街２５號二樓,7400,112.83,65.59,17.64,22,2,7,有,4,2,2,25.028671,121.528356,陽台外推；其他增建；
11408,公寓,台北市大安區永康街１７巷２１號四樓,1020,94.16,10.84,2.93,47.5,4,5,無,1,0,1,25.032488,121.530757,二等親姊弟買賣親友、員工、共有人或其他特殊關係間之交易；
11408,公寓,台北市大安區新生南路一段１６１巷３９號四樓,4150,92.85,44.69,16.34,51.5,4,4,無,2,2,1,25.034623,121.537003,其他增建為陽台加窗頂樓加蓋；夾層；其他增建；
11408,公寓,台北市大安區永康街２巷３號四樓,3450,89.92,38.37,11.65,0,4,4,無,4,2,2,25.033242,121.529571,陽台外推；頂樓加蓋；其他增建；
11408,大樓,台北市大安區復興南路二段３０５號十四樓,9100,160.02,66.95,6.31,1.2,14,23,有,4,2,2,25.024264,121.543602,
11408,華廈,台北市大安區泰順街４０巷１７號六樓之１,1950,127.95,15.24,3.64,20.3,6,7,無,2,2,1,25.024428,121.530276,陽台外推；其他增建；
11408,大樓,台北市大安區復興南路二段３０１號十樓,7260,156.92,56.11,5.1,1.2,10,23,有,3,2,2,25.024235,121.543712,
11408,大樓,台北市大安區和平東路一段１７７之２號十二樓,4308,99.07,50.18,5.22,47.6,12,12,有,1,2,1,25.026475,121.532483,現況頂樓防水層部分失效致滲漏水至後陽台之情形，賣方補貼新台幣下同28萬元整及簽約時簽立增補契約第二條之隔間牆面之費用31.2萬元，共計59.2萬雙方約定不入履約專戶，買方得自應支付之尾款中扣除。其他增建；
11408,公寓,台北市大安區永康街８巷１１號二樓,2780,106.51,26.1,9.91,52.8,2,4,無,3,2,1,25.03243,121.529231,其他增建；
11408,華廈,台北市大安區新生南路二段５６號二樓,8400,122.48,68.59,11.63,39.8,2,7,有,4,2,2,25.02854,121.53398,陽台外推；
11408,大樓,台北市大安區瑞安街１４２巷８號五樓之３,2168,138.78,14.46,3.13,18.8,5,13,有,1,2,1,25.029697,121.541746,塔式車位無固定樓層。陽台外推；其他增建；
11408,大樓,台北市大安區建國南路二段５５號二十一樓,40068,266.12,174.94,20.04,7.6,21,31,有,無隔間,0,0,25.031783,121.538188,
