objName,age
G5敦南自在尊爵豪邸,14.3
文普世貿高樓景觀四房,44.7
大安捷運出口二樓店辦,43.8
B3新生金華☆捷運電梯宅,42
大安捷運精美2房大廈,50.8
近大安運動中心公寓二樓,50.8
東區名喬財金大樓坡車,35.6
101景觀五房坡車名宅,38.8
森林公園夏朵名邸,18.6
近大巨蛋華廈正兩房,47.6
忠孝新生海關4房,41.8
雙龍學區電梯四房,42.2
忠孝敦化雙仁愛電梯3房,47.2
大安極品三樓美寓,49
六張犁安居三房美寓,47.4
中正國中學區美宅,2
忠孝阿波羅遠眺101,48.2
H3世貿雙捷運福氣四房,44.7
敦南信義雙車位,45.1
忠孝東路機械平面車位,46.2
森林溫州綠意庭園美一樓,43.2
和平賞名邸+大坡車,25.8
麗水金華大面寬店辦,43.2
仁愛鑽石林蔭景觀,48.9
大安公園整棟10戶,14.2
榮耀敦南高樓景觀,22.1
正東區塔式車位,21.8
大安捷運雙主臥坡平車位,14.3
忠孝復興微風住辦,49.3
HZ1大安稀有一樓露台樓中樓,26.3
敦南御所三房豪邸,5.5
&大安區友座臻璽坡平車面公園,8.5
國館仁愛翠亨一樓車,13.3
信義安和面寬大店面,49.4
附中學區車位,23.8
大安站美麗二房車,32.3
&面仁愛國小電梯三房,49.5
忠孝敦化美麗華廈,46.7
青田莊園大戶附先到停車位,55
捷運信義安和邊間華廈,47.7
【忠孝敦化站｜國館・電梯二房】,47.5
公館金鑽面寬店面,42.2
忠孝敦化挑高4米小豪宅,19.6
HZ6忠孝復興邊間四房美廈,43.1
附中郵政靜巷三房,39.1
H4122 敦南名園4大房車,32.3
古亭站狀元吉第2房車,35.5
正羅斯福路MONEY金店面,1
大安達永秋鄉一樓庭院戶,2.8
E22敦南林蔭2房,50.8
國泰瑞安懷石高樓豪邸,17
榮耀敦南帝豪景,22.1
瑞安街靜巷豪邸,16.3
SOGO國泰電梯高樓,53.1
J9中正國中學區置產金店面,15.8
忠孝復興101絕美華廈,44.3
建成皇宮稀有大戶,38.8
仁愛北歐名邸,47.5
文普國際美景四房,44.7
文普典藏醫生世家,44.7
敦南靜巷邊間鼎家,45.8
信義安和捷運大車庫一樓,45.3
明日博朝南名邸,10.2
安和捷運仁愛學區美寓,42.1
古亭捷運站旁全新賺錢金店面,4.4
大安公園庭院車庫壹樓,42.7
溫州庭院車庫四房,42.7
信義敦化四房+車位,35.4
瑞安璽朵208巷小豪宅,10.8
&敦南冠德三房平車,37.3
東區頂好邊間名店,38.2
F6大安森林｜庭院戶x坡車,40.6
專任大安站稀有停車位出售,37.5
信義安和獨戶住辦,41.7
信義安和捷運仁愛學區住辦二樓,41.7
師大電梯獨戶4房車,29.7
捷運龍門台大書香世家,42.4
忠孝新生雙併華廈,41.8
信義安和黃金二樓店辦,41.7
&忠孝復興4房電梯租坡車,43.1
敦安公園明亮住辦,41.7
台大雙龍學區電梯明亮美廈,42.2
信義安和邊間一樓,48.6
J7超值東門捷運高樓住辦,49.1
國泰仁愛朝南靜巷美廈,45.5
瑞安精裝四房美廈,42.3
信義翡麗附中對面(塔式車位),17.5
瑞安住辦一樓車,38.2
捷運101景觀車位,24.9
信義安和美景車,24.9
大安面寬雙金面,49.4
信義安和捷運邊間四房,40.7
信義安和電梯邊間三房,44.7
信義安和電梯邊間四房,40.7
【敦化站｜東區216巷．店辦】,51.8
六張犁大三房雙陽台美寓,47.4
大安黃金店面．稀有釋出,48
忠孝統領商辦高樓,41.3
EZ8登峰大廈｜附中｜三房｜坡車,2.3
敦南林蔭高樓兩房,50.8
【忠孝復興站｜極品樓王】,37.1
信義安和甲第名宮高樓附車位,43.3
大安區稀有透天,38.8
&基泰台大高樓景觀露台戶,13.2
遠企安和3房平車,40.8
敦南遠企安和大漢敦爵車位,23
師大附中近大安捷運面公園,50.3
狂降8億股本房客收租店,41.6
敦南新鑽景闊名邸,39.4
世貿文普電梯景觀宅,44.7
遠企敦南SRC面公園,17.4
009-信義安和捷運金店,44.1
明日博朝南101制震豪邸,10.2
&敦南璞真豪邸,10.8
新生金華獨棟二樓美寓,43.8
仁愛安和都更案+車位,45.1
JZ6師大商圈黃金店面,49.5
附中大安捷運優質二樓,51.6
大安稀有瑞安街店辦,46.4
信義安和角窗金店面,43.3
安和信義二線金店面,49.1
Y499吉美富徠高樓景觀戶,1.8
【六張犁｜危老都更・潛力黑土】,57.8
台大雲和獨棟公寓頂加,40.9
台北之星全新尊邸,4
敦南225面林蔭,29.7
大巨蛋黃金住店辦+車位,38.9
#忠孝延吉華廈鼎佳,40.1
市民大道塔式車位,19.6
101美景安和賞易改回兩房,18.3
H4新生金華永康美四房車,29.3
新生金華永康獨棟美廈+車位,29.3
皇勝瑞安 名人巷樓中樓,16.9
世界敦南便宜車位,17.2
K2忠孝敦化置產收租首選,57.3
師大靜巷挑高庭院大戶,34.1
忠孝SOGO名人邊間三房,54.9
忠孝新生站靜寬巷華廈,41.8
忠孝建國雙捷獨立店辦,26.4
信義安和坡道平面車位,47
遠企敦南珍藏戶,43.9
&敦南自在獨棟豪邸平車,14.3
正仁愛稀有國館金店,46
仁愛A+精品名邸附車位,17.4
仁愛敦南都更土地,
【忠孝新生站｜海關．黃金二樓】,59.3
JZ4師大路商圈面寬金店面,55.8
【國館｜光復南路・樹海店辦】,45.2
東區統領整層酒店商旅,41.3
台北星鑽尊榮景觀名邸,4
大巨蛋捷運旁純辦,44.9
富邦藝術面101三房景觀,1.3
森林公園層峰豪邸,17
信義安和邊間四房平車,44.3
明日博朝南高樓,10.2
&金華龍門學區一樓,45.9
F9金華學區師大景觀頂家,46.6
東方大廈邊間大戶,47.3
光南信義美二房,43.2
敦南林蔭景觀3房,47.1
延吉街三角窗金店面,44.3
F9師大商圈面寬一樓店面,46.6
信義安和仁愛學區孝親壹樓可停車,48.6
龍門學區次高樓帝景,45.4
水樹之間名邸,9.2
敦南225林蔭景觀店辦,29.7
仁愛延吉雙車位,47.3
敦化風采車位-機械平面,31.2
金華龍門溫州美廈,39.5
★仁愛路住四土地★,
敦南林蔭亮麗5房,43.3
古亭捷運店地,
附中全新景觀豪邸,5.7
敦南金品綠蔭五房,43.3
FZ5仁愛學區靜巷邊間美居,48.6
光南信義美2+1房,43.2
【大安站｜附中・阿曼仁愛A+】,17.4
三普復興捷運旁挑高管理二房,39.6
敦南樹海景觀美宅,50.8
B3仁愛綠蔭高樓景觀宅,49.3
【敦南｜樹海景觀・挑高4米8】,50.8
附中住四大土地美寓,61.5
高屋建瓴・安沐居,3.1
中正國中一樓門前可停車,43.6
敦南林蔭景觀美宅,50.8
忠孝北科大面寬金店,26.4
忠孝建國捷運面寬店面,26.4
專．大安森林公園三樓,51.7
信義安和一樓邊間美辦,48.6
驚喜價師大夜市雙店面商業土地,55.2
信義安和站超值車位,17.1
仁愛敦南都更土地,
大安安居三房美廈,42.3
大安森林公園景觀四房坡車,37.1
附中學區電梯四房,47.2
稀有釋出捷運旁住辦大樓,44.3
微風合砌雲開美二房,4.8
微風合砌雲開高樓景觀,4.8
昇陽精緻2房,17.8
成功國宅亮麗3房,40.8
附中學區電梯4房,47.2
國館捷運電梯學區4房,38.6
文普國際景觀四房,44.7
雙捷運電梯3房美廈,45.7
E29信義安和美廈2樓3房3衛,44.3
文普國際精緻四房,44.7
信義安和華廈邊間3房,44.7
給愛車一個家,23.8
師大青見倉儲車位,16.6
公園捷運景觀三房,44.3
忠孝復興捷運三房雙衛,44.3
忠孝敦化國泰皇家,50.9
延吉公園電梯四房,43.3
雙仁愛學區大安名人巷名邸,55.3
辛亥.芳和學區宅,50.8
光復國小邊間4房,38.6
藏蘊金華中正國中電梯學區宅,11.8
樂利路靜巷獨戶大三房,42.3
安和敦安景觀雅緻三房,42.2
大安101醫生世家景觀四房,44.7
世貿文普景觀4房,44.7
忠孝敦化捷運電梯三房,47.2
忠孝敦化精品華廈,38.9
敦南傳家三角窗金店面,47.6
新生南路收租▲窗全家金店面,49.3
大安Money金華設籍美宅,1
文普精美大四房,44.5
新生金華設籍套房,42
大安面公園百坪大戶,50.8
南溫州超級金店面,46.9
大安區經典中的晶典電梯3房方正採光佳,17.4
仁愛安和華園名廈,41.9
仁愛樹景景觀美宅,38.8
溫州院書香名邸,0.8
專約忠孝復興統創精品宅,1.9
東帝士樓中樓+雙坡車,36.6
光復南一層美寓3房,54.2
東區SOGO精品宅,55.5
瑞安庭院精美大戶,40.6
E13六張犁4+5美寓,52.7
光復南傳家大土地透天,25.9
附中學區挑高美宅,17.4
信義安和站通化收租美寓,45.3
信義安和站通化收租美寓,45.3
森林公園新生金華整棟華廈,14.2
捷運六張犁黃金二樓,42.8
敦南電腦停車位,16.8
忠孝東路帝王景緻辦公,41.3
正東區統領美妝景觀辦公,41.3
忠孝敦化美妝邊間商辦,41.3
統領商業大樓,41.3
統領高樓辦公,41.3
忠孝統領高樓保值商辦,41.3
附中住辦新裝潢,47.2
正馬路三角窗店面,44.3
忠孝敦化高樓商辦,41.3
中正國中電梯大戶(原四房),39.9
台電大樓全新黃金來財店面,1
正基隆路雙捷運美廈,44.7
樂利安和捷運華廈,48.1
附中學區三房進大安森活圈,39.1
敦南安和大面寬店住,48.5
101景觀採光3+1房,44.7
忠孝復興國泰華廈,54.1
國館三青面寬店辦,44.1
信義御邸景觀樓,6.5
信安國際大樓辦公,44.5
忠孝復興站大面寬診所金店,49.2
大安站電梯三房有車位有裝潢,39.6
大安區標準電梯三房加車位,47.1
忠孝復興站收租金雞,53.1
40遠晀101文普高樓,44.7
林肯大廈敦南第一排潛力小宅,50.8
A11大安敦化南林蔭美兩房,50.8
信義安和一樓店辦,49.8
大安硯坡道平面大車位,15.8
金山南路店面,55.3
金山南大面寬金店面,55.3
E98東門捷運大路邊金店面,55.3
仁愛公園華廈鼎佳,48.3
敦南名園名邸+車位,32.3
安和遠企低總金店面,45.5
和平六張犁B2車位,22.4
正安和路一段美廈,49.8
E73忠孝SOGO收租高投報,47.8
世紀風華車位(全新裝潢),23.3
地上權麟光捷運10房2廳加車位,56.2
潤泰金融新鑽石大樓,39.4
中正國中庭院2房+坡車,2
敦南首都小宅,40.1
通化燙金收租店面,36.8
【忠孝敦化｜東區統領商業辦公】,41.4
信義安和101景觀樓中樓加車位,24.9
信義安和101景觀樓中樓加車位,24.9
近捷運忠孝新生2+1房,49.3
忠孝98景觀智慧純辦14,2.6
忠孝98綠意智慧純辦2,2.6
忠孝98景觀智慧純辦10,2.6
忠孝98帝景智慧純辦15,2.6
忠孝98景觀智慧純辦12,2.6
忠孝98景觀智慧純辦6,2.6
忠孝98綠意智慧純辦3,2.6
忠孝98綠意智慧純辦5,2.6
忠孝98景觀智慧純辦13,2.6
忠孝98景觀智慧純辦11,2.6
忠孝98綠意智慧純辦4,2.6
大安精裝低總價,49.3
麟光捷運安居兩房雅寓,52.7
忠孝敦化景觀商辦,41.3
信義安和站精裝優質豪辦,40.3
忠孝敦化全新裝潢商辦,41.3
師大附中學區高樓層景觀房,47.2
敦南邊間大三房,40.9
SOGO靜巷四房車,29.7
忠孝統領高樓商辦,41.3
敦南保富寰宇微型商辦,42.7
仁愛延吉商業店面,44.1
敦南陸裝高樓３房,40.9
安和遠企低總金店面,45.5
科技大樓捷運住辦,41.3
雙龍金華電梯二房,20.4
溫州溫馨2房,46.9
信義安和金雞母透天,37.8
成功國宅商鋪,40.8
師大收租金店面,55.8
永康商圈面寬雙金店,50.9
師大面寬美店面,55.3
東區面寬大店面,47.6
師大青田設籍金店面,48
安和路三角窗賺錢金店面,46.5
正青田街三角窗透天厝,93.8
師大商圈面寬收租店面,55
仁愛鑽石邊間四房,48.9
林蔭仁愛帝寶,20.4
台大三角窗黃金店面,52.2
敦南安和遠企金店辦,51.6
師大商圈台電大樓站一樓金店,44.8
E93敦南林蔭亮麗電梯五房,43.3
統創緻雙捷運精品,1.9
仁愛林蔭鑽石名邸,48.9
敦南信義金店面,36.4
敦南遠企樹海景觀廈,43.3
豪景帝寶豪門大戶-歡迎店配,20.4
金山南路金店面,55.3
正金山南路店面,55.3
台大南溫州電梯四房華廈,48
敦南復興中學美廈,47.5
敦南sogo氣派豪邸,55.3
忠孝復興微風小豪宅,4.8
*通安街精美華廈$,32.3
敦南名園名邸+車位,32.3
潤泰大安富陽2房附車,1.5
E20大安商圈低公設四房景觀宅,44.7
國父紀念館高樓採光4房,38.6
臨江夜市旁文普高樓景觀四房,44.7
國館捷運大巨蛋鼎加,44.8
大安森林公園電梯大戶,48.8
桓桓溫州高樓2房車,-1.4
信義安和優質地段兩房,50.8
瑞安信義全新高樓景觀宅,1.3
信義安和捷運都更透天洋房,72.7
中正國中大面寬一樓好停車6米巷,49.8
興盛【臨江夜市】鈔集透天店面,54.8
安和&仁愛雙學區三房1樓,48.6
文普國際醫生世家景觀四房,44.7
文普世貿高樓景觀美四房,44.7
&信義安和電梯三房,44.7
46東區阿波羅優質住辦,48.2
忠孝敦化美麗華廈,46.7
捷運商二土地店辦-1,51.3
捷運商二土地店辦-2,51.3
基隆路二段臨江車位,41.7
(專任約)正義高樓景觀家,38.9
忠孝敦化捷運站高樓商辦,41.3
中正國中古亭捷運高樓管理景觀美廈,39.9
J8仁愛稀有透天金店,64.7
森林公園歐式極簡整棟新廈,14.2
東區SOGO住辦高樓,56.7
破盤忠孝敦化庭園金店,46.1
正義高樓將軍戶,38.9
X08捷運忠孝敦化統領景觀辦公,41.3
忠孝SOGO旁高樓住辦,56.7
信義安和採光住辦,41.7
忠孝統領金鑽商辦,41.3
帝寶景觀電梯華廈,42.3
敦南冠德園,37.3
10金華國中面公園典雅二房,14
成功國宅三房,40.8
莎士比亞極稀有釋出,37.1
C20大安區精華電梯2房,50.8
&麟光捷運稀有四房車,19.3
敦南名仕樹海二房,50.8
新生南路庭院一樓,51.3
師大附中學區四房住辦大樓,47.2
新生金華青田高樓明亮方正大三房,42
中正國中高樓四房+車位,36
明星學區中正國中一樓車,49.8
H4中正金華方正美寓,44.6
東區大安路電梯管理兩房,46.5
信義永康商圈金店,18
敦化南雙捷運全新景觀兩房,50.8
T504正敦化南全新裝潢高樓,50.8
敦化南雙捷運全新景觀兩房,50.8
V46敦南樹海緻美電梯社區兩房,50.8
和平高中二樓璞玉,49.4
金華國中/大土地面寬大戶,50.1
21仁愛賦玉一層一戶美邸,18.8
台北新家住辦管理美廈,36.8
近捷運台大公館欣欣大廈,45.3
忠孝大安三角窗2樓店辦,49.2
SOGO大安椿萱,2.7
台大樹海獨棟電梯頂佳,45.6
捷運電梯高樓景觀三房,44.3
忠孝復興邊間可看101大樓,44.3
忠孝敦化捷運美辦,41.8
大巨蛋三角人氣雙店面,48.9
216巷店面,47.9
東區收租三角窗純一樓,49.8
忠孝敦化捷運辦公,41.8
東區捷運美辦公,41.8
正金山南路優質店面,55.3
捷運國父紀念館金店面,45.2
大安區全新景觀鋼骨大樓,11.4
敦南元大柏悅珍藏,15.9
忠孝敦化捷運金店面,48.3
&元大柏悅樹海豪邸,15.9
&仁愛華園大四房,44.5
統領賺錢小A辦,41.3
台大豪園傳家金店面,44.6
忠孝敦化帷幕純辦,35.6
通化街三角窗店面,44.9
忠孝ZARA辦公,41.3
鑄慕層峰2房,-1
信義安和庭院車庫一樓,45.3
金華國中+雙龍學區極美四房黃金三樓公寓,58.1
大巨蛋明曜百貨雙店面,52.6
正金山南路三角窗雙店面雙車位,26
&敦南璞真名宅,10.8
潤泰敦仁~高樓樹海景觀,17.8
科技捷運帷幕純辦,37.1
通化車庫一樓,45.3
和平大苑精裝小豪宅,11.3
東門面寬一樓美寓,55.8
【六張犁站｜正馬路・黃金二樓】,48.9
台電大樓捷運羅曼羅蘭4房名邸,35.3
昌承辦-信義安和邊間電梯三房,44.7
忠孝敦化站前面寬純辦,41.8
大巨蛋國館收租金店面,40.5
東區面寬廣告捷運店辦,41.8
忠孝敦化捷運辦公,41.8
忠孝延吉一級金店面,48.5
捷運忠孝敦化站邊間高樓景觀美辦公,41.3
SOGO微風大面寬二樓店辦,44.3
Sogo忠孝復興佳品,38.9
E06忠孝敦化捷運高樓收租商辦,41.3
元大柏悅露臺戶樹海名邸,15.9
信義敦南核心三房首選,36.4
信義安和捷運都更透天,66.5
信義安和捷運美寓,43.9
文普世貿高樓美景四房,44.7
臨江街唯一釋出金雞母店面,46.3
【師大｜金華國中．低總二房】,51.5
通化臨江收租透天厝,38.6
&忠孝復興東區鑽石店霸,52.9
大安信義高樓管理三房,49
永康新生面公園頂加美寓,38.8
忠孝SOGO黃金店面,44.3
師大夜市捷運商圈金店,55.2
敦化林蔭四房,43.3
師大夜市一樓,55.3
忠孝凌雲大廈高質感住辦,53.4
師大龍泉收租雙金店,55.3
敦南信義金店面,36.4
正仁愛路四段稀有面寬一樓,51.6
東區醒目康是美店王,45.2
仁愛延吉雙併華廈,43.6
大安森林公園稀有庭院車庫一樓,42.7
東區頂好名店面,38.2
古亭站商二旅館,36
世貿景觀純辦,35.5
國父紀念館金店面,43.2
四維路採光店辦,40.8
忠孝復興217巷高樓華廈,55.4
敦南安和捷運3房~可營登,41.8
S1480稀有信義安和電梯套房,18.7
國父紀念館金店,44.9
瑞安庭園一樓有車位,40.6
東區明曜優質收租住辦,46.7
六張犁賓士大廈,41.9
瑞安靜謐庭院一樓有坡車,40.6
信義安和稀有獨戶美宅,41.7
台北東區忠孝敦化,12.4
延吉美妝大庭院一樓,44.4
正面台大美景名邸,30.2
仁愛學區壹樓3房+車位,48.6
信義安和仁愛靜巷邊間可停車,48.6
東區微風高樓二房,4.8
大安區三面採光公寓,44.1
安和樹海景觀三房,42.2
小靜精選-台北科大優質社區管理電梯美三房,35.8
忠孝敦化統領商業大樓I,41.3
364BH大安邊間公寓1F,44.9
敦南紅樓景觀4房,40.3
大安區科技大樓捷運旁三房,51.1
大安捷運附中收租美寓,43.3
師大熱鬧商圈金店面,55.3
師大商區面寬黃金店面,50.3
大安捷運附中收租美寓,43.3
大安森公園電梯3房雙拼方正3面採光,48.8
台北星鑽景觀2房+車位,4
仁愛光復靜巷電梯雙拼大4房,46.3
大安森林公園黃金地段,48.8
大安站二樓商辦,43.8
仁愛雙星美辦,44.3
森林公園『溫州院』全新豪邸高樓,0.8
大安森林龍門國中美廈,48.8
敦南學府精美庭院一樓,6.7
師大商圈隔套收租華廈,16.3
明曜大土地知名金店,48
國館大空間方正四房美廈,43.3
羅斯福路柏克萊大廈,39.9
大安邊間一樓大地下室,45.8
泰順街面寬大店面,46.4
安和雙橡園華廈3房,44.3
台大商圈面寬店面,42.2
國館大面寬庭院金店辦,44.5
信義捷運101豪景樓中樓,24.9
忠孝復興華廈,49.5
大巨蛋捷運4房,44.8
C210大安區面寬住辦店,38.9
信義捷運101豪景樓中樓+車,24.9
E17公館捷運店辦,39.3
信義安和電梯空中花園大戶,47.7
麟光捷運亮麗3房,48.8
告別繞圈師大休旅車,17.3
A554敦南遠企捷運都更美屋,52.1
富邦藝樹如意樓1,1.3
♥麟光世外地上權透天,58.2
北溫州梅花車位四房,42.7
溫州庭院一樓,42.7
東區低總價金店Ⅲ,38.2
東區低總價金店Ⅱ,38.2
東區低總價金店Ⅰ,38.2
忠孝敦化捷運統領商辦,41.3
忠孝敦化捷運統領商辦,41.3
國北師森林公園金店面,39.8
通安街都更透天,65.7
東區216巷店王投報3.3%,50.3
人潮就是現金流入主東區核心金店,1.8
敦南林蔭高樓2房,50.8
忠孝復興SOGO商圈面寬金店面,52.9
東區SOGO金店面,48.6
福華高樓景觀附中學區,47.2
忠孝敦化金店面,48.3
忠孝敦化捷運電梯三房美廈,47.2
統領商業大樓小坪數辦公室,41.3
E63專賣科技捷運收租金店面,46.2
師大附中黑土透天,64.6
信義敦南核心三房首選,36.4
仁愛天廈精品3房豪邸,39.4
忠孝復興｜SOGO商圈黃金置產,44.3
大安捷運高樓靜巷,49
金華國中設籍新成屋首選！,1
元大栢悅露臺戶樹海名邸,15.9
仁愛林蔭鑽石名邸,48.9
統創緻雙捷運精品,1.9
東區漢宮住辦景觀採光裝潢優,50.5
東區核心靜巷雅居,44.8
大安縱橫天下捷運宅,12.8
成功國宅看中庭,40.8
東豐街黃金門牌稀有傳家金店面,41.3
近六張犁捷運電梯美套房,38.1
大安捷運站高樓景觀宅,47.2
六張犁雅致美居,38.1
建成皇宮101景觀電梯管理五房+B1坡車,38.8
大巨蛋靜巷美寓,44.8
大安區整修漂亮套房,38.1
敦南富邦藝樹高樓層2,1.3
光復仁愛興雅學區‧靜巷三房,44.8
SOGO商圈金店面,44.3
通化夜市收租屋,46.1
忠孝新生捷運面寬一樓,35.6
E91科技大樓收租金店面,46.3
忠孝敦化捷運優質住辦大樓,41.8
大安MONEY(2),1
敦化南電梯景觀美妝2房,50.8
稀有統創緻高樓景觀戶,1.9
敦南遠企林蔭住辦,46.8
大安通化商圈文普景觀電梯四房,44.7
大安健身館獨立出口,46.3
S1452仁愛玉璽美居3A,-1
S1432仁愛玉璽美居6B,-1
S1451仁愛玉璽美居4A,-1
13信義謙華豪邸,14.4
&富邦藝樹林蔭露台戶,1.3
大安樂利路美寓,42.3
S1450仁愛玉璽美居6A,-1
S1448仁愛玉璽美居4B,-1
科技大樓站商三金雞母,46.3
金山南路聚財金店面+平面車位,26
專任紅樓庭院車位一樓,40.3
師大夜市面寬收租金店面,54.2
S1449仁愛玉璽美居3B,-1
國館靜巷大3房美寓,44.8
大安MONEY賦寓8B,1
大安御邸至高樓中樓,12.8
忠孝SOGO人潮店面,42.1
忠孝敦化捷運商辦收租,41.3
通化潛力透天,38.8
仁愛圓環邊間二樓,48.9
忠孝敦化商辦,41.3
敦南林蔭高樓採光2房,50.8
❤忠孝新生高樓管理美廈,35.8
臨江連鎖▲窗透天店面,52.8
潮州街一樓前後院,43.2
國父紀念館高樓美廈,38.6
忠孝復興捷運優質商辦,44.3
東區羅馬名廈,49.4
S1460忠孝敦化捷運商辦,41.3
忠孝敦化統領商圈辦公,41.3
敦南林蔭景觀低總電梯二房,50.8
忠孝敦化金店面,48
成功國宅辦公室,40.8
國館捷運收租雅室,45.9
成功國宅3房,40.8
羅斯福路古亭捷運站商務旅店,36
古亭捷運高效益商旅,36
&東區景觀鼎加美廈,38.8
雙仁愛學區忠孝統領商圈華廈,47.2
國館巨蛋.仁愛國中電梯頂加,43.2
忠孝復興站 華廈邊間美4房,43.1
&$仁愛帝寶C棟典藏臻品,20.4
捷運信義安和低總一樓,49.3
金華師大商圈黑土收租,52
敦南樹海美2房,50.8
大安捷運美寓重建屋,58.9
仁愛香榭景觀高樓,49.3
敦南樹海景觀邊間高4米8,50.8
忠孝東路四段地下城,49.3
科技捷運邊間面寬黃金二樓店,51.3
科技捷運黃金二樓店,51.3
東區全家聚寶盆二樓,46.7
成功國宅辦公室2,40.8
溫州街靜巷庭院車庫一樓,42.7
溫州街梅花庭院車庫一樓,42.7
大安御邸低調隱密宅,12.8
C024溫州四房大壹樓,42.7
溫州街庭院一樓,42.7
【古亭站｜金華國中・師大一樓】,46.3
永康文青面寬店,59.5
敦南國泰一品高樓,48.2
安和遠企收租金店面,42.2
133敦南遠企黃金店面,40.9
&仁愛帝寶,20.4
東區三角金店面,46
東區統領大三角黃金店霸,51.6
台大土地整棟傳家寶,59.5
東門捷運收租一樓,55.5
通化錢潮金店面,35.3
明日博山景高樓雙車,10.2
忠孝延吉金店,49.3
SOGO收租金店面I,61.4
忠孝敦化商用收租一樓,48.3
師大經典時尚店面,41.2
忠孝216金店面,47.5
忠孝ZARA名店,56.5
明日博高樓朝南,10.2
正臨江街危老透天,38.9
師大店面,49.6
獨賣正通化街超派店面,48.3
仁愛御品高樓雅居,16.1
遠企敦南金店面,40.9
敦南遠企面寬金店,40.9
東區角間優質店面,47.8
ZARA統領店面,51.6
安和遠企收租金店,44.1
遠企安和收租黃金店面,44.1
遠企敦南收租金店,40.9
安和收租店面,44.3
056-仁愛路帝寶旁金店面,49.2
信義光南三角窗金店,41.3
國際連鎖旗艦金店,30.6
大安區路旁邊間黃金店面,39.8
敦南新鑽石林蔭尊邸,39.4
敦南遠企金店面,46.8
E18國父紀念館捷運店辦,43.2
光復南路收租透天厝,61.6
170-信義光南三角窗金店,41.3
大安敦南黃金一樓,55.8
信義光復三角窗金店,41.3
忠孝敦化潮店II,39.5
師大路三角窗旗艦金店面,38.2
忠孝敦化潮店I,39.5
敦南遠企黃金店,40.9
東區精華金店面(A),39.5
光南延吉靜巷美寓,42.4
北科大黃金店面,41.4
森林公園金華九野豪邸,13.2
016-敦南安和收租店面,44.1
臨江夜市低總旺店,31.3
光南靜巷黃金2樓美寓,42.4
信義光南三角窗金店,41.3
敦南遠企收租金店,40.9
東區精華金店面(B),39.5
首泰信義捷運鋼骨制震豪邸,4.3
瑞安大空間店辦,49.4
忠孝東路大巨蛋金店面,43.2
E39台電捷運收租透天厝,
信義光南三角金店,41.3
敦化南路遠企金店面,40.3
僑福三角窗金店面,43.3
大安四維漂亮住辦二樓,50.9
002-遠企安和收租店面,44.1
仁愛復興透天金店面,63.9
忠孝東路年收近400萬金店,45.8
大安區仁愛圓環旁精華地段建地,
統領百貨商辦,41.4
通化邊間一樓車,44.9
明日博,10.2
台大龍門大面寬店面,42.2
大安吉美花園新豪宅,4.6
信義安和捷運電梯四房,45.2
敦南寓邸豪華4房,9.4
忠孝復興SOGO金店面,48.8
安和捷運都更美廈,47.7
忠孝敦化賺錢金店面,48.3
明曜神旺面寬金店,48.3
信義安和危老透天,72.3
捷運SOGO面寬餐飲金店,54.3
忠孝ZARA住辦平車,43.3
仁愛圓環三角窗旗艦店霸,44.5
ZARA店王,49.8
E94信義安和稀有都更透天,72.8
信義光復三角窗金店面,41.3
通化街人潮透店,64.3
E95忠孝敦化金店面,48.3
附中高樓可住辦有坡車,47.2
金華龍門泰順鼎加,49.9
六張犁大馬路上傳家金店面,45.3
古亭捷運正馬路稀有透天,62
台大精華三角窗店面,40.5
國父紀念館庭院店面,43.2
明日博高樓朝南,10.2
中正國中古亭庭院1樓,19
統創緻次頂樓景觀戶I,1.9
公館商圈黃金店面,39.9
金華龍門學區公寓三樓,58.1
大安邊間面公園雙捷美房,52.7
J12信義安和三角窗店面,41.3
東區增值餐飲店面,53.3
&敦南璞真毛胚美宅,10.8
